{"schema_version":1,"mode":"demo","generated_utc":"2026-10-19T12:00:00Z","as_of_utc":"2026-10-19T12:00:00Z","source":"demo-generator","signals":[{"id":"SIG-XAUUSD-M15-1792411200","symbol":"XAUUSD","timeframe":"M15","created_utc":"2026-10-19T12:00:00Z","probability":null,"validation":{"status":"unvalidated","source":null},"note":"Illustrative rule engine. No validated edge exists (research verdict WAIT), so no probability is shown.","action":"WAIT","entry":null,"stop_loss":null,"take_profit":null,"risk_reward":null,"reasons":[{"kind":"info","text":"No trigger: regime RANGE, trend RANGE, no recent sweep."},{"kind":"info","text":"ATR(14) = 846 pips; stop distance 677 pips."}],"checks":[{"name":"Spread gate","passed":true,"detail":"effective spread 40.0 pips = 6% of stop (limit 25%)"},{"name":"Structure trigger","passed":false,"detail":"none found"},{"name":"Validated edge","passed":false,"detail":"No strategy has passed FDR-controlled validation"},{"name":"Execution","passed":false,"detail":"Trading disabled in this build (research only)"}]},{"id":"SIG-XAUUSD-H1-1792411200","symbol":"XAUUSD","timeframe":"H1","created_utc":"2026-10-19T12:00:00Z","probability":null,"validation":{"status":"unvalidated","source":null},"note":"Illustrative rule engine. No validated edge exists (research verdict WAIT), so no probability is shown.","action":"SELL","entry":4038.22,"stop_loss":4052.682509962842,"take_profit":4015.596250996284,"risk_reward":1.56,"reasons":[{"kind":"pro","text":"Buy-side liquidity sweep 3 candle(s) ago, closed back below 4042.26."},{"kind":"info","text":"ATR(14) = 1808 pips; stop distance 1446 pips."},{"kind":"info","text":"Target at the nearest support zone."}],"checks":[{"name":"Spread gate","passed":true,"detail":"effective spread 40.0 pips = 3% of stop (limit 25%)"},{"name":"Structure trigger","passed":true,"detail":"sweep or trend pullback found"},{"name":"Validated edge","passed":false,"detail":"No strategy has passed FDR-controlled validation"},{"name":"Execution","passed":false,"detail":"Trading disabled in this build (research only)"}]},{"id":"SIG-EURUSD-M15-1792411200","symbol":"EURUSD","timeframe":"M15","created_utc":"2026-10-19T12:00:00Z","probability":null,"validation":{"status":"unvalidated","source":null},"note":"Illustrative rule engine. No validated edge exists (research verdict WAIT), so no probability is shown.","action":"BUY","entry":1.12616,"stop_loss":1.1256410130261196,"take_profit":1.1268981013026118,"risk_reward":1.42,"reasons":[{"kind":"pro","text":"Sell-side liquidity sweep 1 candle(s) ago, closed back above 1.12638."},{"kind":"info","text":"ATR(14) = 6 pips; stop distance 5 pips."},{"kind":"info","text":"Target at the nearest resistance zone."}],"checks":[{"name":"Spread gate","passed":true,"detail":"effective spread 1.0 pips = 19% of stop (limit 25%)"},{"name":"Structure trigger","passed":true,"detail":"sweep or trend pullback found"},{"name":"Validated edge","passed":false,"detail":"No strategy has passed FDR-controlled validation"},{"name":"Execution","passed":false,"detail":"Trading disabled in this build (research only)"}]},{"id":"SIG-EURUSD-H1-1792411200","symbol":"EURUSD","timeframe":"H1","created_utc":"2026-10-19T12:00:00Z","probability":null,"validation":{"status":"unvalidated","source":null},"note":"Illustrative rule engine. No validated edge exists (research verdict WAIT), so no probability is shown.","action":"SELL","entry":1.12616,"stop_loss":1.128220497910784,"take_profit":1.1223933593314508,"risk_reward":1.83,"reasons":[{"kind":"pro","text":"Buy-side liquidity sweep 4 candle(s) ago, closed back below 1.12796."},{"kind":"info","text":"ATR(14) = 10 pips; stop distance 8 pips."},{"kind":"info","text":"Target at the nearest support zone."}],"checks":[{"name":"Spread gate","passed":true,"detail":"effective spread 1.0 pips = 12% of stop (limit 25%)"},{"name":"Structure trigger","passed":true,"detail":"sweep or trend pullback found"},{"name":"Validated edge","passed":false,"detail":"No strategy has passed FDR-controlled validation"},{"name":"Execution","passed":false,"detail":"Trading disabled in this build (research only)"}]},{"id":"SIG-GBPUSD-M15-1792411200","symbol":"GBPUSD","timeframe":"M15","created_utc":"2026-10-19T12:00:00Z","probability":null,"validation":{"status":"unvalidated","source":null},"note":"Illustrative rule engine. No validated edge exists (research verdict WAIT), so no probability is shown.","action":"BUY","entry":1.29975,"stop_loss":1.2990588431035919,"take_profit":1.300786735344612,"risk_reward":1.5,"reasons":[{"kind":"pro","text":"Uptrend (HH/LL) with a pullback to the 20-EMA."},{"kind":"info","text":"ATR(14) = 9 pips; stop distance 7 pips."},{"kind":"info","text":"No opposing zone found: target set to 1.5R."}],"checks":[{"name":"Spread gate","passed":true,"detail":"effective spread 1.2 pips = 17% of stop (limit 25%)"},{"name":"Structure trigger","passed":true,"detail":"sweep or trend pullback found"},{"name":"Validated edge","passed":false,"detail":"No strategy has passed FDR-controlled validation"},{"name":"Execution","passed":false,"detail":"Trading disabled in this build (research only)"}]},{"id":"SIG-GBPUSD-H1-1792411200","symbol":"GBPUSD","timeframe":"H1","created_utc":"2026-10-19T12:00:00Z","probability":null,"validation":{"status":"unvalidated","source":null},"note":"Illustrative rule engine. No validated edge exists (research verdict WAIT), so no probability is shown.","action":"WAIT","entry":null,"stop_loss":null,"take_profit":null,"risk_reward":null,"reasons":[{"kind":"info","text":"No trigger: regime TREND_UP, trend UP, no recent sweep."},{"kind":"info","text":"ATR(14) = 20 pips; stop distance 16 pips."}],"checks":[{"name":"Spread gate","passed":true,"detail":"effective spread 1.2 pips = 7% of stop (limit 25%)"},{"name":"Structure trigger","passed":false,"detail":"none found"},{"name":"Validated edge","passed":false,"detail":"No strategy has passed FDR-controlled validation"},{"name":"Execution","passed":false,"detail":"Trading disabled in this build (research only)"}]},{"id":"SIG-GBPJPY-M15-1792411200","symbol":"GBPJPY","timeframe":"M15","created_utc":"2026-10-19T12:00:00Z","probability":null,"validation":{"status":"unvalidated","source":null},"note":"Illustrative rule engine. No validated edge exists (research verdict WAIT), so no probability is shown.","action":"WAIT","entry":null,"stop_loss":null,"take_profit":null,"risk_reward":null,"reasons":[{"kind":"info","text":"No trigger: regime TREND_UP, trend UP, no recent sweep."},{"kind":"info","text":"ATR(14) = 18 pips; stop distance 14 pips."}],"checks":[{"name":"Spread gate","passed":true,"detail":"effective spread 1.5 pips = 10% of stop (limit 25%)"},{"name":"Structure trigger","passed":false,"detail":"none found"},{"name":"Validated edge","passed":false,"detail":"No strategy has passed FDR-controlled validation"},{"name":"Execution","passed":false,"detail":"Trading disabled in this build (research only)"}]},{"id":"SIG-GBPJPY-H1-1792411200","symbol":"GBPJPY","timeframe":"H1","created_utc":"2026-10-19T12:00:00Z","probability":null,"validation":{"status":"unvalidated","source":null},"note":"Illustrative rule engine. No validated edge exists (research verdict WAIT), so no probability is shown.","action":"BUY","entry":193.66,"stop_loss":192.80188192419988,"take_profit":194.94717711370018,"risk_reward":1.5,"reasons":[{"kind":"pro","text":"Sell-side liquidity sweep 5 candle(s) ago, closed back above 192.885."},{"kind":"info","text":"ATR(14) = 33 pips; stop distance 27 pips."},{"kind":"info","text":"No opposing zone found: target set to 1.5R."}],"checks":[{"name":"Spread gate","passed":true,"detail":"effective spread 1.5 pips = 5% of stop (limit 25%)"},{"name":"Structure trigger","passed":true,"detail":"sweep or trend pullback found"},{"name":"Validated edge","passed":false,"detail":"No strategy has passed FDR-controlled validation"},{"name":"Execution","passed":false,"detail":"Trading disabled in this build (research only)"}]}]}
